Username,Message,Date,Link,Keyword,Image
https://t.me/milelion,Yes 25% off is great. MCC is 5814 for grab dine out.,2025-02-07 02:36:21,https://t.me/https://t.me/milelion/1071868,mcc,
https://t.me/milelion,Hi! Do u happen to know MCC for alley on 25? If they charge as hotel or food? Bursting limit on my “food” card 😣,2025-02-07 02:24:43,https://t.me/https://t.me/milelion/1071858,mcc,
https://t.me/milelion,"check on instarem app the mcc for the gym, more likely this one excluded",2025-02-07 01:15:30,https://t.me/https://t.me/milelion/1071839,mcc,
https://t.me/milelion,"Actually Hor….

Isn’t it just easier to bring YouTrip card and withdraw. Yes there might be a 1% fee if u exceed $400 a month. You can easily topup YouTrip in sgd and convert it at rates better than Mastercard Visa. So that could partially subsidise the 1% fee.",2025-02-06 18:00:09,https://t.me/https://t.me/milelion/1071753,topup,
https://t.me/milelion,"UOB PPV - 1.1k per month
UOB ladies - (Choose 2 Cat) 2k
Citirewards / DBSWWMC - 1+1.5k (Online website) 
HSBC revolution - 1k",2025-02-06 14:52:46,https://t.me/https://t.me/milelion/1071702,hsbc revo,
https://t.me/milelion,"If you have 12 months apart then can maximise even better 

But you need to check whether under travel or resto MCC",2025-02-06 14:48:34,https://t.me/https://t.me/milelion/1071696,mcc,
https://t.me/milelion,boils down to MCC. should be classified as online,2025-02-06 13:34:02,https://t.me/https://t.me/milelion/1071675,mcc,
https://t.me/milelion,is there a list i can refer to? I tried searching but everywhere tells me different things? Or is just based on the MCC corde,2025-02-06 13:33:35,https://t.me/https://t.me/milelion/1071673,mcc,
https://t.me/milelion,"Hi has anyone gotten the 6mpd on ocbc rewards card for heymax vouchers declined ? I called up ocbc cso today and they said the bonus points are for physical department stores only , not for online , even though they checked that the MCC was correct.",2025-02-06 12:29:26,https://t.me/https://t.me/milelion/1071627,mcc,
https://t.me/milelion,"Tracking MCC, heymax promos (eg. Bus/mrt)",2025-02-06 12:20:46,https://t.me/https://t.me/milelion/1071625,mcc,
https://t.me/milelion,"#dp

Man-U this EPL season
never win 2 consecutive EPL matches in a row.

This fact guarantee that Man-U will win one EPL match/ month for sure.
So, Man-U Maybank card holders can do once a month shopping. 
(some months probably twice)

all good luck!",2025-02-06 09:34:47,https://t.me/https://t.me/milelion/1071602,#dp,
https://t.me/milelion,"Hello. Which card is good for education mcc 8299 usd5000? I only have ocbc rewards, citi premier, citi rewards and uob prvi",2025-02-06 09:24:34,https://t.me/https://t.me/milelion/1071590,mcc,
https://t.me/milelion,"also when in doubt about monkey mcc, i suppose chocolate would be a safer bet? uob ladys is whitelist versus chocolate is blacklist",2025-02-06 06:11:54,https://t.me/https://t.me/milelion/1071525,mcc,
https://t.me/milelion,"They earmarked meaning they can choose to charge or don't charge, without card holder signing or physical card.

If they choose not to settle or charge, UOB will auto cancel transaction on T+ 5 working days, for hotel mcc code",2025-02-06 05:58:49,https://t.me/https://t.me/milelion/1071502,mcc,
https://t.me/milelion,Hi! apart from OCBC Voyage are there alternatives e.g. AMEX HighFlyer Card that can be use on mcc 8062 for private hospital bills?,2025-02-06 05:41:22,https://t.me/https://t.me/milelion/1071490,mcc,
https://t.me/milelion,receive the gift ecapitavoucher for buying amex chubb travel insurance but not yet receiving the 15$ecapita voucher for the referral link,2025-02-06 05:13:24,https://t.me/https://t.me/milelion/1071474,travel insurance,
https://t.me/milelion,Think your only recourse is to check with the bank whether can waive this fee as you weren't aware this purchase fell under this MCC,2025-02-06 02:37:47,https://t.me/https://t.me/milelion/1071401,mcc,
https://t.me/milelion,The bank told me MCC 4829 will incur cash advance fee as it's considered quasi cash transaction.,2025-02-06 02:37:03,https://t.me/https://t.me/milelion/1071399,mcc,
https://t.me/milelion,I made an online purchase but the transaction was somehow under MCC 4829 - Money transfer. Hence I was charged cash advance fee,2025-02-06 02:36:00,https://t.me/https://t.me/milelion/1071396,mcc,
https://t.me/milelion,"Never heard of MCC codes that can incurr advance fee. May wanna check with your issuing bank if there is one, and if so, why?",2025-02-06 02:35:27,https://t.me/https://t.me/milelion/1071392,mcc,
https://t.me/milelion,"cash advance fee no way to waive?
made a purchase online and the MCC was 4829!",2025-02-06 02:31:15,https://t.me/https://t.me/milelion/1071387,mcc,
https://t.me/milelion,Odd. What did you try? My last trip all were almost immediately (to test mcc),2025-02-05 15:44:02,https://t.me/https://t.me/milelion/1071251,mcc,
https://t.me/milelion,"Anyone has dp on the MCC for Singtel Shop - phone purchase online (not bills)? Tried using Amaze to check but after hitting 'reject' to authorise the txn, I'm not seeing it as a declined txn and hence no mcc details. 

I also don't have/will max out CRMC/WWMC.",2025-02-05 14:42:33,https://t.me/https://t.me/milelion/1071222,mcc,
https://t.me/milelion,Same question regrading mcc 8641. In my case it's an online payment. So any dp if wwmc covers it?,2025-02-05 06:48:39,https://t.me/https://t.me/milelion/1070880,mcc,
https://t.me/milelion,"Check if MCC is in exclusion list with an empty amaze card. If not excluded, will likely be counted.",2025-02-05 06:07:32,https://t.me/https://t.me/milelion/1070829,mcc,
